"name","description","category","subCategory","stockQty","isOrganic","isFeatured","isAvailable","tags","images","v1_size","v1_unit","v1_mrp","v1_price","v1_sku","v2_size","v2_unit","v2_mrp","v2_price","v2_sku","v3_size","v3_unit","v3_mrp","v3_price","v3_sku"
"Baked Multigrain Chips","Lightly baked multigrain chips with oats quinoa and seeds — guilt-free crunchy snacking","Chips & Namkeen","","60","false","true","true","chips,multigrain,baked,healthy","https://images.unsplash.com/photo-1566478989037-eec170784d0b?w=600&q=80","60g","g","49","39","BMGC-60G","120g","g","89","74","BMGC-120G","","","","",""
"Spicy Mixture Bombay","Classic Bombay mixture with fried noodles boondi and peanuts tossed in tangy spice blend","Chips & Namkeen","","80","false","false","true","mixture,bombay,spicy,fried","https://images.unsplash.com/photo-1566478989037-eec170784d0b?w=600&q=80","200g","g","79","64","BMBX-200G","400g","g","149","119","BMBX-400G","","","","",""
"Masala Peanuts Spicy","Crunchy gram flour-coated peanuts with Indian spices — a satisfying high-protein snack","Chips & Namkeen","","100","false","false","true","peanut,masala,coated,spicy","https://images.unsplash.com/photo-1567620905732-2d1ec7ab7445?w=600&q=80","200g","g","69","59","MPNT-200G","400g","g","129","109","MPNT-400G","","","","",""
"Rice Crackers Japanese Style","Light airy Japanese-style rice crackers with soy glaze — crispy and surprisingly addictive","Chips & Namkeen","","50","false","false","true","rice,crackers,japanese,light","https://images.unsplash.com/photo-1566478989037-eec170784d0b?w=600&q=80","100g","g","99","84","RCRK-100G","200g","g","189","159","RCRK-200G","","","","",""
"Trail Mix Nuts and Berries","Energy-boosting trail mix with almonds cashews walnuts cranberries and dark chocolate chips","Chips & Namkeen","","60","false","true","true","trailmix,nuts,berries,energy","https://images.unsplash.com/photo-1567620905732-2d1ec7ab7445?w=600&q=80","100g","g","149","129","TRMX-100G","250g","g","339","289","TRMX-250G","","","","",""
"Masala Noodles Classic","Spicy masala instant noodles ready in 2 minutes — India's most loved midnight snack","Instant Noodles","","150","false","false","true","noodles,masala,instant,spicy","https://images.unsplash.com/photo-1569718212931-9b5f5fb4c19a?w=600&q=80","70g","g","15","12","MASN-70G","4 pcs","pcs","55","44","MASN-4PCS","","","","",""
"Chicken Noodles Savory","Rich chicken-flavoured instant noodles with savoury broth seasoning and springy noodle strands","Instant Noodles","","100","false","false","true","noodles,chicken,savory,instant","https://images.unsplash.com/photo-1569718212931-9b5f5fb4c19a?w=600&q=80","70g","g","15","12","CHKN-70G","4 pcs","pcs","55","44","CHKN-4PCS","","","","",""
"Atta Wheat Noodles Healthy","Instant noodles made from whole wheat atta — lower in refined flour and higher in fibre","Instant Noodles","","80","false","false","true","noodles,atta,wholewheat,healthy","https://images.unsplash.com/photo-1569718212931-9b5f5fb4c19a?w=600&q=80","70g","g","18","15","ATTN-70G","4 pcs","pcs","64","54","ATTN-4PCS","","","","",""
"Rice Vermicelli Thin","Delicate thin rice vermicelli noodles gluten-free and quick cooking — great for soups stir fries","Instant Noodles","","60","false","false","true","vermicelli,rice,thin,glutenfree","https://images.unsplash.com/photo-1569718212931-9b5f5fb4c19a?w=600&q=80","200g","g","59","49","VERM-200G","400g","g","109","89","VERM-400G","","","","",""
"Cup Noodles Prawn","Convenient hot prawn-flavoured cup noodles — just add boiling water for a satisfying meal in minutes","Instant Noodles","","80","false","false","true","cup,noodles,prawn,convenient","https://images.unsplash.com/photo-1569718212931-9b5f5fb4c19a?w=600&q=80","75g","g","49","39","CUPN-75G","","","","","","","","","",""
"Hakka Noodles Pan-Fry","Medium-thick Hakka noodles perfect for Chinese-style pan frying with vegetables and sauces","Instant Noodles","","70","false","false","true","hakka,noodles,chinese,stirfry","https://images.unsplash.com/photo-1569718212931-9b5f5fb4c19a?w=600&q=80","200g","g","49","39","HAKK-200G","400g","g","89","74","HAKK-400G","","","","",""
"Soba Buckwheat Noodles","Japanese-style soba noodles made from buckwheat flour — nutty earthy and gluten-reduced","Instant Noodles","","40","false","false","true","soba,buckwheat,japanese,nutty","https://images.unsplash.com/photo-1569718212931-9b5f5fb4c19a?w=600&q=80","200g","g","149","129","SOBA-200G","","","","","","","","","",""
"Maggi Oats Masala Noodles","Oats-enriched Maggi-style noodles with vegetable masala — a healthier twist on the classic favourite","Instant Noodles","","80","false","false","true","noodles,oats,masala,healthy","https://images.unsplash.com/photo-1569718212931-9b5f5fb4c19a?w=600&q=80","65g","g","20","16","OATN-65G","4 pcs","pcs","74","59","OATN-4PCS","","","","",""
"Dal Makhani Restaurant Style","Rich slow-cooked black lentil dal makhani with butter cream — restaurant quality at home","Ready to Eat","","60","false","true","true","dal,makhani,punjabi,rich","https://images.unsplash.com/photo-1565557623262-b51c2513a641?w=600&q=80","300g","g","129","109","DALM-300G","","","","","","","","","",""
"Palak Paneer Ready","Creamy spinach gravy with soft paneer cubes — a Punjabi classic ready to heat and serve","Ready to Eat","","50","false","true","true","palak,paneer,spinach,punjabi","https://images.unsplash.com/photo-1565557623262-b51c2513a641?w=600&q=80","300g","g","139","119","PPNR-300G","","","","","","","","","",""
"Chole Masala Spiced","Hearty Punjabi chickpeas cooked in bold tangy tomato masala — perfect with bhature or rice","Ready to Eat","","60","false","false","true","chole,chickpea,masala,punjabi","https://images.unsplash.com/photo-1565557623262-b51c2513a641?w=600&q=80","300g","g","119","99","CHOL-300G","","","","","","","","","",""
"Rajma Chawal Pack","Wholesome kidney bean rajma in rich tomato gravy served with steamed basmati rice","Ready to Eat","","50","false","false","true","rajma,chawal,kidney,bean","https://images.unsplash.com/photo-1565557623262-b51c2513a641?w=600&q=80","400g","g","149","129","RJMC-400G","","","","","","","","","",""
"Vegetable Biryani Ready","Fragrant long-grain basmati biryani with seasonal vegetables saffron and whole spices","Ready to Eat","","50","false","true","true","biryani,vegetable,basmati,saffron","https://images.unsplash.com/photo-1563379091339-03246963d96c?w=600&q=80","350g","g","169","149","VBRN-350G","","","","","","","","","",""
"Chicken Biryani Hyderabadi","Authentic dum-style Hyderabadi chicken biryani with tender marinated chicken and fragrant rice","Ready to Eat","","40","false","true","true","biryani,chicken,hyderabadi,dum","https://images.unsplash.com/photo-1563379091339-03246963d96c?w=600&q=80","400g","g","199","169","CBRN-400G","","","","","","","","","",""
"Poha Breakfast Mix","Ready-to-cook poha mix with flattened rice roasted peanuts dried coconut and curry leaves","Ready to Eat","","80","false","false","true","poha,breakfast,readytocook,quick","https://images.unsplash.com/photo-1547592166-23ac45744acd?w=600&q=80","200g","g","59","49","POHA-200G","400g","g","109","89","POHA-400G","","","","",""
"Upma Semolina Mix","Flavoured semolina upma mix with vegetables cashews and spices — South Indian breakfast in 5 minutes","Ready to Eat","","80","false","false","true","upma,semolina,southindian,breakfast","https://images.unsplash.com/photo-1565557623262-b51c2513a641?w=600&q=80","200g","g","59","49","UPMA-200G","400g","g","109","89","UPMA-400G","","","","",""
"Idli Dosa Batter Ready","Freshly ground fermented idli and dosa batter — authentic taste without the overnight soaking","Ready to Eat","","60","false","true","true","idli,dosa,batter,fermented","https://images.unsplash.com/photo-1565557623262-b51c2513a641?w=600&q=80","1kg","kg","99","84","IDLI-1KG","2kg","kg","189","159","IDLI-2KG","","","","",""
"Moong Dal Khichdi","Wholesome moong dal khichdi with vegetables ghee and mild spices — comfort food in a pack","Ready to Eat","","60","false","false","true","khichdi,moong,comfort,wholesome","https://images.unsplash.com/photo-1565557623262-b51c2513a641?w=600&q=80","300g","g","119","99","KHCH-300G","","","","","","","","","",""
"Pav Bhaji Masala Kit","Complete pav bhaji kit with spiced vegetable bhaji mix and soft Mumbai pav rolls — party-ready","Ready to Eat","","40","false","true","true","pavbhaji,mumbai,masala,kit","https://images.unsplash.com/photo-1547592166-23ac45744acd?w=600&q=80","500g","g","199","169","PVBJ-500G","","","","","","","","","",""
"Shahi Paneer Gravy","Luxurious royal paneer gravy with cashew cream tomato and aromatic spices — heat and serve","Ready to Eat","","40","false","true","true","shahipaneer,gravy,royal,cream","https://images.unsplash.com/photo-1565557623262-b51c2513a641?w=600&q=80","300g","g","149","129","SHPN-300G","","","","","","","","","",""
"Sambar Ready South Indian","Authentic South Indian sambar with lentils tamarind and sambar powder — pairs with idli dosa rice","Ready to Eat","","60","false","false","true","sambar,southindian,lentil,tamarind","https://images.unsplash.com/photo-1565557623262-b51c2513a641?w=600&q=80","300g","g","99","84","SMBR-300G","","","","","","","","","",""
"Halwa Sooji Instant Mix","Instant suji halwa mix with ghee sugar and cardamom — traditional prasad sweet in minutes","Ready to Eat","","60","false","false","true","halwa,sooji,instant,sweet","https://images.unsplash.com/photo-1551024601-bec78aea704b?w=600&q=80","200g","g","79","64","HALW-200G","400g","g","149","119","HALW-400G","","","","",""
"Pasta Arrabiata Ready","Spicy Italian arrabiata pasta in fiery tomato sauce — microwave-ready gourmet meal in 3 minutes","Ready to Eat","","40","false","false","true","pasta,arrabiata,italian,spicy","https://images.unsplash.com/photo-1555949258-eb67b1ef0ceb?w=600&q=80","300g","g","149","129","PARB-300G","","","","","","","","","",""
"Chicken Breast Boneless Skinless","Premium skinless boneless chicken breast — lean high-protein perfect for grilling baking and salads","Chicken","","80","false","true","true","chicken,breast,boneless,lean","https://images.unsplash.com/photo-1598103442097-8b74394b95c5?w=600&q=80","500g","g","229","199","CHBR-500G","1kg","kg","429","379","CHBR-1KG","","","","",""
"Chicken Curry Cut Fresh","Freshly cleaned curry-cut chicken pieces with bone — ideal for marinating and Indian gravies","Chicken","","100","false","false","true","chicken,currycut,fresh,bone-in","https://images.unsplash.com/photo-1598103442097-8b74394b95c5?w=600&q=80","500g","g","199","169","CHCC-500G","1kg","kg","369","319","CHCC-1KG","","","","",""
"Chicken Thighs Boneless","Juicy flavourful boneless chicken thighs with slightly more fat — excellent for curries and grilling","Chicken","","80","false","false","true","chicken,thigh,boneless,juicy","https://images.unsplash.com/photo-1598103442097-8b74394b95c5?w=600&q=80","500g","g","219","189","CHTH-500G","1kg","kg","409","359","CHTH-1KG","","","","",""
"Chicken Legs Drumsticks","Meaty chicken drumsticks great for tandoor frying or slow-cooked masala curries","Chicken","","80","false","false","true","chicken,legs,drumstick,meaty","https://images.unsplash.com/photo-1598103442097-8b74394b95c5?w=600&q=80","4 pcs","pcs","199","169","CHDM-4PCS","8 pcs","pcs","369","319","CHDM-8PCS","","","","",""
"Chicken Wings Buffalo Cut","Plump chicken wings cut into flats and drumettes — perfect for buffalo sauce bakes and BBQs","Chicken","","70","false","false","true","chicken,wings,buffalo,bbq","https://images.unsplash.com/photo-1598103442097-8b74394b95c5?w=600&q=80","500g","g","189","169","CHWG-500G","1kg","kg","369","329","CHWG-1KG","","","","",""
"Chicken Mince Keema Fresh","Fresh minced chicken keema — ideal for seekh kebabs kofta stuffed parathas and bolognese","Chicken","","80","false","false","true","chicken,keema,mince,fresh","https://images.unsplash.com/photo-1598103442097-8b74394b95c5?w=600&q=80","500g","g","189","169","CHMN-500G","1kg","kg","369","329","CHMN-1KG","","","","",""
"Chicken Whole Dressed","Whole fresh dressed chicken cleaned and ready to cook — perfect for roasting and whole pot curries","Chicken","","40","false","false","true","chicken,whole,dressed,roast","https://images.unsplash.com/photo-1598103442097-8b74394b95c5?w=600&q=80","1 pc","pcs","299","259","CHWL-1PC","","","","","","","","","",""
"Chicken Liver Fresh","Fresh chicken liver packed with iron B12 and folate — great for liver fry masala and pâté","Chicken","","50","false","false","true","chicken,liver,iron,fresh","https://images.unsplash.com/photo-1598103442097-8b74394b95c5?w=600&q=80","250g","g","79","64","CHLV-250G","500g","g","149","119","CHLV-500G","","","","",""
"Chicken Strips Marinated","Tender chicken strips pre-marinated in tandoori spices — grill or pan fry for quick meals","Chicken","","60","false","true","true","chicken,strips,marinated,tandoori","https://images.unsplash.com/photo-1598103442097-8b74394b95c5?w=600&q=80","300g","g","249","209","CHST-300G","600g","g","469","399","CHST-600G","","","","",""
"Mutton Goat Curry Cut","Fresh goat mutton curry cut pieces — slow-cooked for rogan josh nihari and authentic biryanis","Chicken","","50","false","false","true","mutton,goat,currycut,fresh","https://images.unsplash.com/photo-1544025162-d76538485491?w=600&q=80","500g","g","449","399","MUTC-500G","1kg","kg","879","779","MUTC-1KG","","","","",""
"Pomfret Silver Whole Fresh","Fresh silver pomfret with delicate white flesh and mild flavour — excellent for frying and curry","Fish","","50","false","true","true","pomfret,silver,fresh,delicate","https://images.unsplash.com/photo-1535234780-1c571b79d21b?w=600&q=80","500g","g","349","309","POMF-500G","1kg","kg","679","599","POMF-1KG","","","","",""
"Surmai King Fish Steak","Premium king fish steaks with firm meaty flesh — perfect for frying masala and grilling","Fish","","50","false","true","true","surmai,kingfish,steak,firm","https://images.unsplash.com/photo-1535234780-1c571b79d21b?w=600&q=80","500g","g","399","349","SURM-500G","1kg","kg","769","679","SURM-1KG","","","","",""
"Rohu Fish Fresh Whole","Fresh water Rohu fish with tender flesh and mild flavour — a North and East Indian staple","Fish","","60","false","false","true","rohu,freshwater,fresh,bengali","https://images.unsplash.com/photo-1535234780-1c571b79d21b?w=600&q=80","500g","g","199","169","ROHU-500G","1kg","kg","379","319","ROHU-1KG","","","","",""
"Hilsa Ilish Fish Fresh","The prized Hilsa fish from the Ganges with oily rich flesh and a distinctive aroma","Fish","","30","false","true","true","hilsa,ilish,bengali,premium","https://images.unsplash.com/photo-1535234780-1c571b79d21b?w=600&q=80","500g","g","499","449","HILS-500G","1kg","kg","979","879","HILS-1KG","","","","",""
"Tilapia Fillet Boneless","Mild flaky boneless tilapia fillet — great for grilling baking fish tacos and light curries","Fish","","60","false","false","true","tilapia,fillet,boneless,mild","https://images.unsplash.com/photo-1535234780-1c571b79d21b?w=600&q=80","500g","g","249","219","TILA-500G","1kg","kg","489","429","TILA-1KG","","","","",""
"Tiger Prawns Large","Large juicy tiger prawns with a firm bite and sweet flavour — great for prawn masala biryani and stir fry","Fish","","40","false","true","true","prawn,tiger,large,juicy","https://images.unsplash.com/photo-1565680018434-b513d5e5fd47?w=600&q=80","250g","g","299","259","TGPR-250G","500g","g","579","499","TGPR-500G","","","","",""
"Bangda Mackerel Fresh","Fresh Indian mackerel (bangda) with rich oily flesh and bold flavour — perfect for Goan curry and fry","Fish","","60","false","false","true","mackerel,bangda,goan,oily","https://images.unsplash.com/photo-1535234780-1c571b79d21b?w=600&q=80","500g","g","199","169","BANG-500G","1kg","kg","379","319","BANG-1KG","","","","",""
"Salmon Fillet Norwegian","Premium Norwegian salmon fillet rich in omega-3 fatty acids — best for pan-searing and sushi","Fish","","30","false","true","true","salmon,norwegian,omega3,premium","https://images.unsplash.com/photo-1535234780-1c571b79d21b?w=600&q=80","200g","g","649","569","SALM-200G","400g","g","1199","1049","SALM-400G","","","","",""
"Squid Calamari Fresh","Fresh whole squid (calamari) with tender rings and tentacles — great for frying stuffing and curries","Fish","","40","false","false","true","squid,calamari,fresh,rings","https://images.unsplash.com/photo-1565680018434-b513d5e5fd47?w=600&q=80","250g","g","199","169","SQID-250G","500g","g","379","319","SQID-500G","","","","",""
"Crab Mud Crab Fresh","Fresh live mud crab with meaty claws and rich coral roe — a coastal delicacy for masala and butter crab","Fish","","25","false","true","true","crab,mud,fresh,coastal","https://images.unsplash.com/photo-1565680018434-b513d5e5fd47?w=600&q=80","500g","g","449","399","MCRA-500G","1kg","kg","879","779","MCRA-1KG","","","","",""
"Pomfret Silver Fresh","Whole fresh silver pomfret with delicate white flesh — ideal for shallow fry tawa fish and coastal curries","Fish","","35","false","true","true","pomfret,silver,fresh,coastal","https://images.unsplash.com/photo-1535234780-1c571b79d21b?w=600&q=80","500g","g","349","299","POMF-500G","1kg","kg","649","569","POMF-1KG","","","","",""
"Hilsa Ilish Fresh","Premium hilsa (ilish) fish with rich fatty flesh and signature aroma — a Bengali delicacy for mustard curry","Fish","","20","false","true","true","hilsa,ilish,bengali,premium","https://images.unsplash.com/photo-1535234780-1c571b79d21b?w=600&q=80","500g","g","499","429","HILS-500G","1kg","kg","969","849","HILS-1KG","","","","",""
"Organic Quinoa White","Premium white quinoa high in plant protein and all nine essential amino acids — great for salads and bowls","Grains & Staples","","80","true","true","true","quinoa,white,organic,protein","https://images.unsplash.com/photo-1586201375761-83865001e31c?w=600&q=80","500g","g","299","249","QUIN-500G","1kg","kg","549","469","QUIN-1KG","","","","",""
"Rolled Oats Quick Cook","100% whole grain rolled oats for a nutritious breakfast — quick-cook variety ready in 3 minutes","Grains & Staples","","150","false","false","true","oats,rolled,quick,breakfast","https://images.unsplash.com/photo-1586201375761-83865001e31c?w=600&q=80","500g","g","99","84","OATS-500G","1kg","kg","179","149","OATS-1KG","","","","",""
"Mustard Oil Kachi Ghani","Cold-pressed kachi ghani mustard oil with pungent flavour and high MUFA content — ideal for Bengali cooking","Pantry","","120","false","false","true","mustard,oil,kachi ghani,cold pressed","https://images.unsplash.com/photo-1474979266404-7eaacbcd87c5?w=600&q=80","500ml","ml","129","109","MSTO-500M","1L","L","229","199","MSTO-1L","","","","",""
"Ghee Pure Cow","Pure cow ghee made from grass-fed cows using traditional bilona method — rich aroma and golden colour","Pantry","","90","false","true","true","ghee,cow,pure,bilona","https://images.unsplash.com/photo-1474979266404-7eaacbcd87c5?w=600&q=80","250g","g","249","219","GHEE-250G","500g","g","469","419","GHEE-500G","","","","",""
"Turmeric Powder Organic","Certified organic turmeric powder with high curcumin content and vibrant golden colour","Herbs & Seasonings","","200","true","false","true","turmeric,organic,curcumin,golden","https://images.unsplash.com/photo-1615485500834-bc10199bc727?w=600&q=80","100g","g","79","64","TURMORG-100G","200g","g","139","119","TURMORG-200G","","","","",""
"Red Chilli Powder Kashmiri","Bright Kashmiri red chilli powder known for deep colour with mild heat — essential for tandoori and gravies","Herbs & Seasonings","","180","false","false","true","chilli,kashmiri,red,mild","https://images.unsplash.com/photo-1615485500834-bc10199bc727?w=600&q=80","100g","g","69","59","KSHM-100G","200g","g","125","105","KSHM-200G","","","","",""
"Whole Almonds Premium","Whole premium California almonds rich in Vitamin E healthy fats and protein — great as a snack and topping","Dry Fruits","","100","false","true","true","almonds,premium,california,nuts","https://images.unsplash.com/photo-1508061253366-f7da158b6d46?w=600&q=80","250g","g","249","219","ALMD-250G","500g","g","469","419","ALMD-500G","","","","",""
"Cashews W320 Whole","Premium W320 grade whole cashews with creamy buttery taste — ideal for snacking cooking and sweets","Dry Fruits","","90","false","true","true","cashews,W320,whole,premium","https://images.unsplash.com/photo-1508061253366-f7da158b6d46?w=600&q=80","250g","g","299","259","CASH-250G","500g","g","569","499","CASH-500G","","","","",""
