"name","description","category","subCategory","stockQty","isOrganic","isFeatured","isAvailable","tags","images","v1_size","v1_unit","v1_mrp","v1_price","v1_sku","v2_size","v2_unit","v2_mrp","v2_price","v2_sku","v3_size","v3_unit","v3_mrp","v3_price","v3_sku"
"Kesar Alphonso Mangoes","Sun-ripened Alphonso mangoes from Ratnagiri with honey-sweet flesh and saffron aroma — the king of mangoes","Fresh Fruits","","80","true","true","true","mango,alphonso,kesar,premium","https://images.unsplash.com/photo-1601493700631-2b16ec4b4716?w=600&q=80","500g","g","249","209","ALPH-500G","1kg","kg","469","399","ALPH-1KG","2kg","kg","899","749","ALPH-2KG"
"Banganapalli Mangoes","Large golden Banganapalli mangoes from Andhra with fibre-free flesh and mild sweetness","Fresh Fruits","","70","false","false","true","mango,banganapalli,andhra","https://images.unsplash.com/photo-1601493700631-2b16ec4b4716?w=600&q=80","1kg","kg","199","169","BANG-1KG","2kg","kg","379","319","BANG-2KG","","","","",""
"Royal Gala Apples","Crisp honey-sweet Royal Gala apples imported from New Zealand — perfect for snacking and salads","Fresh Fruits","","90","false","true","true","apple,gala,imported,crisp","https://images.unsplash.com/photo-1568702846914-96b305d2aaeb?w=600&q=80","4 pcs","pcs","149","129","GALA-4PCS","6 pcs","pcs","209","179","GALA-6PCS","1kg","kg","279","239","GALA-1KG"
"Shimla Fuji Apples","Firm juicy Fuji apples grown in the cool Himalayan hills of Himachal Pradesh with a balanced sweet-tart taste","Fresh Fruits","","80","false","false","true","apple,fuji,shimla,himachal","https://images.unsplash.com/photo-1568702846914-96b305d2aaeb?w=600&q=80","4 pcs","pcs","129","109","FUJI-4PCS","1kg","kg","239","199","FUJI-1KG","","","","",""
"Robusta Bananas","Farm-ripened Robusta bananas packed with potassium and quick energy — great pre-workout or as a breakfast","Fresh Fruits","","120","false","false","true","banana,robusta,energy,potassium","https://images.unsplash.com/photo-1571771894821-ce9b6c11b08e?w=600&q=80","6 pcs","pcs","49","39","ROB-6PCS","12 pcs","pcs","89","69","ROB-12PCS","","","","",""
"Red Watermelon Seedless","Chilled seedless watermelon with sweet crimson flesh and 92% water content — summer essential","Fresh Fruits","","30","false","true","true","watermelon,seedless,summer,hydration","https://images.unsplash.com/photo-1563114773-84221bd62daa?w=600&q=80","1 pc","pcs","199","169","WMEL-1PC","","","","","","","","","",""
"Thompson Seedless Grapes","Crunchy pale-green seedless grapes with a perfectly balanced sweet-tart bite","Fresh Fruits","","70","false","true","true","grapes,thompson,seedless,green","https://images.unsplash.com/photo-1537640538966-79f369143f8f?w=600&q=80","500g","g","129","109","TGRP-500G","1kg","kg","239","199","TGRP-1KG","","","","",""
"Black Muscat Grapes","Plump black Muscat grapes with a deep sweet floral flavour — rich in resveratrol","Fresh Fruits","","60","false","false","true","grapes,black,muscat,antioxidant","https://images.unsplash.com/photo-1537640538966-79f369143f8f?w=600&q=80","500g","g","149","129","BGRP-500G","1kg","kg","279","239","BGRP-1KG","","","","",""
"Strawberries Premium","Hand-picked plump strawberries bursting with sweetness — perfect for smoothies cakes and fresh eating","Fresh Fruits","","50","false","true","true","strawberry,premium,fresh,berries","https://images.unsplash.com/photo-1464965911861-746a04b4bca6?w=600&q=80","250g","g","149","129","STRW-250G","500g","g","279","239","STRW-500G","","","","",""
"Kiwi Zespri Green","Premium Zespri green kiwis bursting with vitamin C — one kiwi provides your full daily vitamin C requirement","Fresh Fruits","","80","false","false","true","kiwi,zespri,vitamin-c,green","https://images.unsplash.com/photo-1585059895524-72359e06133a?w=600&q=80","4 pcs","pcs","129","109","KIWI-4PCS","6 pcs","pcs","189","159","KIWI-6PCS","","","","",""
"Mosambi Sweet Lime","Juicy Nagpur sweet lime full of natural electrolytes and vitamin C — best consumed fresh","Fresh Fruits","","100","false","false","true","mosambi,sweetlime,citrus,nagpur","https://images.unsplash.com/photo-1526318472351-c75fcf070305?w=600&q=80","4 pcs","pcs","69","54","MOS-4PCS","8 pcs","pcs","129","99","MOS-8PCS","","","","",""
"Papaya Ripe Orange","Ripe orange-fleshed papaya rich in papain enzyme and beta-carotene — excellent for digestion","Fresh Fruits","","60","false","false","true","papaya,ripe,digestive,tropical","https://images.unsplash.com/photo-1517282009859-f000ec3b26fe?w=600&q=80","500g","g","59","49","PAP-500G","1kg","kg","109","89","PAP-1KG","","","","",""
"Pomegranate Bhagwa","Premium Bhagwa pomegranate with deep red arils and superior sweetness — a heart-health superfood","Fresh Fruits","","50","false","true","true","pomegranate,bhagwa,superfood,antioxidant","https://images.unsplash.com/photo-1615485290382-bc895f8b4a51?w=600&q=80","500g","g","129","109","POM-500G","1kg","kg","239","199","POM-1KG","","","","",""
"Pink Guava Fresh","Soft pink-flesh guavas with tropical aroma — exceptionally high in vitamin C and dietary fibre","Fresh Fruits","","90","false","false","true","guava,pink,vitamin-c,tropical","https://images.unsplash.com/photo-1536511132770-e5058c7e8c46?w=600&q=80","500g","g","59","49","GUAV-500G","1kg","kg","109","89","GUAV-1KG","","","","",""
"Tender Coconut Fresh","Fresh tender coconuts with sweet refreshing water and soft malai — nature's isotonic drink","Fresh Fruits","","50","false","false","true","coconut,tender,nariyal,refreshing","https://images.unsplash.com/photo-1550159930-40066082a4fc?w=600&q=80","1 pc","pcs","49","39","COCO-1PC","2 pcs","pcs","89","69","COCO-2PCS","","","","",""
"Country Tomatoes Desi","Farm-fresh desi tomatoes with bold flavour and rich red colour — the backbone of Indian curries","Fresh Vegetables","","200","false","false","true","tomato,desi,fresh,curry","https://images.unsplash.com/photo-1592924357228-91a4daadcfea?w=600&q=80","500g","g","39","29","TOM-500G","1kg","kg","69","54","TOM-1KG","3kg","kg","189","149","TOM-3KG"
"Red Onions Medium","Firm medium-sized red onions with pungent aroma — essential base for every Indian dish","Fresh Vegetables","","200","false","false","true","onion,red,pyaaz,fresh","https://images.unsplash.com/photo-1508747703725-719777637510?w=600&q=80","500g","g","29","24","ONI-500G","1kg","kg","49","39","ONI-1KG","3kg","kg","129","99","ONI-3KG"
"Baby Potatoes Tender","Small thin-skinned baby potatoes perfect for roasting chaat and dum aloo — no peeling needed","Fresh Vegetables","","120","false","false","true","potato,baby,aloo,tender","https://images.unsplash.com/photo-1518977676601-b53f82aba655?w=600&q=80","500g","g","49","39","BPOT-500G","1kg","kg","89","69","BPOT-1KG","","","","",""
"Agra Potatoes Large","Firm large Agra potatoes with floury texture — ideal for sabzi mash and French fries","Fresh Vegetables","","150","false","false","true","potato,large,agra,aloo","https://images.unsplash.com/photo-1518977676601-b53f82aba655?w=600&q=80","1kg","kg","39","29","LPOT-1KG","3kg","kg","99","79","LPOT-3KG","5kg","kg","149","119","LPOT-5KG"
"Organic Spinach Palak","Fresh organic spinach leaves packed with iron folate and vitamin K — great for dal palak and smoothies","Fresh Vegetables","","80","true","false","true","spinach,palak,organic,iron","https://images.unsplash.com/photo-1576045057995-568f588f82fb?w=600&q=80","250g","g","39","29","SPIN-250G","500g","g","69","54","SPIN-500G","","","","",""
"English Cucumber Long","Seedless English cucumber with thin edible skin mild flavour and high hydration","Fresh Vegetables","","90","false","false","true","cucumber,english,kakdi,salad","https://images.unsplash.com/photo-1568584711271-6c929fb49b60?w=600&q=80","2 pcs","pcs","49","39","ECUC-2PCS","4 pcs","pcs","89","69","ECUC-4PCS","","","","",""
"Red Capsicum","Sweet vibrant red capsicum loaded with vitamin C and antioxidants — ideal for stir fries and grilling","Fresh Vegetables","","70","false","false","true","capsicum,red,shimla,pepper","https://images.unsplash.com/photo-1563565375-f3fdfdbefa83?w=600&q=80","2 pcs","pcs","79","64","RCAP-2PCS","500g","g","99","79","RCAP-500G","","","","",""
"Yellow Capsicum","Mild golden-yellow capsicum with a sweet fruity crunch — adds colour and sweetness to dishes","Fresh Vegetables","","60","false","false","true","capsicum,yellow,shimla,sweet","https://images.unsplash.com/photo-1563565375-f3fdfdbefa83?w=600&q=80","2 pcs","pcs","89","74","YCAP-2PCS","500g","g","109","89","YCAP-500G","","","","",""
"Broccoli Crown","Fresh tender broccoli crown with tightly packed florets rich in sulforaphane and vitamin C","Fresh Vegetables","","60","false","true","true","broccoli,superfood,green,crown","https://images.unsplash.com/photo-1459411621453-7b03977f4bfc?w=600&q=80","500g","g","99","84","BROC-500G","1kg","kg","189","159","BROC-1KG","","","","",""
"Orange Carrots Nantes","Sweet tender Nantes variety carrots high in beta-carotene — great for juicing salads and halwa","Fresh Vegetables","","100","false","false","true","carrot,nantes,orange,betacarotene","https://images.unsplash.com/photo-1598170845058-32b9d6a5da37?w=600&q=80","500g","g","39","29","CAR-500G","1kg","kg","69","54","CAR-1KG","","","","",""
"White Button Mushrooms","Plump white button mushrooms with earthy umami flavour — versatile in pasta curries and soups","Fresh Vegetables","","70","false","false","true","mushroom,button,fungi,umami","https://images.unsplash.com/photo-1504545102780-26774c1bb073?w=600&q=80","200g","g","79","64","MUSH-200G","500g","g","179","149","MUSH-500G","","","","",""
"Sweet Corn Cobs","Farm-fresh golden sweet corn with plump juicy kernels — perfect for grilling raita and chaat","Fresh Vegetables","","80","false","false","true","corn,makai,sweet,cob","https://images.unsplash.com/photo-1508061253366-f7da158b6d46?w=600&q=80","2 pcs","pcs","49","39","CORN-2PCS","4 pcs","pcs","89","69","CORN-4PCS","","","","",""
"Fresh Green Peas Shelled","Sweet tender green peas freshly shelled — perfect for matar paneer pulao and Punjabi curries","Fresh Vegetables","","90","false","false","true","peas,matar,green,shelled","https://images.unsplash.com/photo-1563305289-09a672f87edc?w=600&q=80","250g","g","59","49","PEAS-250G","500g","g","109","89","PEAS-500G","","","","",""
"Cauliflower Fresh Whole","Fresh white cauliflower with tightly packed curd-like florets — ideal for aloo gobi roasts and soups","Fresh Vegetables","","70","false","false","true","cauliflower,gobhi,white,fresh","https://images.unsplash.com/photo-1510627489930-0c1b0bfb6785?w=600&q=80","1 pc","pcs","59","49","GOBI-1PC","2 pcs","pcs","109","89","GOBI-2PCS","","","","",""
"Purple Brinjal Eggplant","Glossy purple brinjal with tender seedy flesh — essential for baingan bharta grills and curries","Fresh Vegetables","","80","false","false","true","brinjal,eggplant,baingan,purple","https://images.unsplash.com/photo-1615484477778-ca3b77940c25?w=600&q=80","500g","g","39","29","BRG-500G","1kg","kg","69","54","BRG-1KG","","","","",""
"French Beans Crisp","Slender crisp French beans with a satisfying snap — great for stir fries thoran and salads","Fresh Vegetables","","70","false","false","true","beans,french,green,crisp","https://images.unsplash.com/photo-1543363136-3fdb62e11be5?w=600&q=80","250g","g","49","39","FRNB-250G","500g","g","89","69","FRNB-500G","","","","",""
"Bottle Gourd Lauki","Tender bottle gourd low in calories and cooling in nature — ideal for lauki sabzi kofta and juice","Fresh Vegetables","","80","false","false","true","lauki,gourd,low-calorie,cooling","https://images.unsplash.com/photo-1546069901-ba9599a7e63c?w=600&q=80","500g","g","29","24","LAUK-500G","1kg","kg","49","39","LAUK-1KG","","","","",""
"Ridge Gourd Turai","Fresh ridge gourd with ridged skin and soft flesh — excellent for turai sabzi and dal","Fresh Vegetables","","70","false","false","true","turai,ridgegourd,sabzi,fresh","https://images.unsplash.com/photo-1546069901-ba9599a7e63c?w=600&q=80","500g","g","29","24","TURA-500G","1kg","kg","49","39","TURA-1KG","","","","",""
"Bitter Gourd Karela","Fresh bitter gourd with a distinct medicinal bitterness known to regulate blood sugar naturally","Fresh Vegetables","","60","false","false","true","karela,bittergourd,diabetic,medicinal","https://images.unsplash.com/photo-1546069901-ba9599a7e63c?w=600&q=80","250g","g","39","29","KARE-250G","500g","g","69","54","KARE-500G","","","","",""
"Drumstick Moringa","Fresh drumstick moringa pods packed with protein calcium and iron — a South Indian staple","Fresh Vegetables","","60","false","false","true","drumstick,moringa,sahjan,superfood","https://images.unsplash.com/photo-1546069901-ba9599a7e63c?w=600&q=80","250g","g","39","29","DSTK-250G","500g","g","69","54","DSTK-500G","","","","",""
"Fresh Coriander Dhania","Bright green fragrant coriander leaves essential for chutneys garnishes and Indian curries","Herbs & Seasonings","","150","true","false","true","coriander,dhania,herb,green","https://images.unsplash.com/photo-1606923829579-0cb981a83e2e?w=600&q=80","100g","g","19","14","DHAN-100G","250g","g","39","29","DHAN-250G","","","","",""
"Fresh Mint Pudina","Cool aromatic mint leaves great for raita chutneys lemonade mojitos and biryanis","Herbs & Seasonings","","100","true","false","true","mint,pudina,herb,cooling","https://images.unsplash.com/photo-1586671267731-da2cf3ceeb80?w=600&q=80","100g","g","19","14","MINT-100G","250g","g","39","29","MINT-250G","","","","",""
"Fresh Ginger Root","Knobby pungent fresh ginger with a warming spicy kick — essential for chai curries and marinades","Herbs & Seasonings","","120","false","false","true","ginger,adrak,spice,warming","https://images.unsplash.com/photo-1615485290382-bc895f8b4a51?w=600&q=80","100g","g","29","24","GING-100G","250g","g","64","54","GING-250G","500g","g","119","99","GING-500G"
"Green Chilies Hari Mirch","Fresh fiery green chilies adding heat and flavour to Indian dishes pickles and chutneys","Herbs & Seasonings","","100","false","false","true","chili,harimirch,spice,hot","https://images.unsplash.com/photo-1583119022894-919a68a3d0e3?w=600&q=80","100g","g","19","14","GCHI-100G","250g","g","39","29","GCHI-250G","","","","",""
"Curry Leaves Kadi Patta","Aromatic fresh curry leaves indispensable for South Indian tempering dals and coconut chutneys","Herbs & Seasonings","","80","false","false","true","curryleaves,kadipatta,southindian,tempering","https://images.unsplash.com/photo-1606923829579-0cb981a83e2e?w=600&q=80","50g","g","19","14","CURV-50G","100g","g","29","24","CURV-100G","","","","",""
"Fresh Garlic Bulbs","Pungent fresh garlic bulbs adding depth and warmth to curries marinades and bread","Herbs & Seasonings","","100","false","false","true","garlic,lahsun,bulb,pungent","https://images.unsplash.com/photo-1501963422762-3d89bd989eb3?w=600&q=80","100g","g","29","24","GARL-100G","250g","g","64","54","GARL-250G","500g","g","119","99","GARL-500G"
"Lemongrass Stalks","Fresh lemongrass stalks with a bright citrusy fragrance used in Thai curries soups and herbal teas","Herbs & Seasonings","","60","false","false","true","lemongrass,herb,thai,citrus","https://images.unsplash.com/photo-1606923829579-0cb981a83e2e?w=600&q=80","100g","g","39","29","LGRS-100G","200g","g","69","54","LGRS-200G","","","","",""
"Fresh Basil Italian","Fragrant Italian basil with sweet peppery aroma — perfect for pesto pasta pizza and salads","Herbs & Seasonings","","50","false","false","true","basil,italian,herb,pesto","https://images.unsplash.com/photo-1606923829579-0cb981a83e2e?w=600&q=80","50g","g","49","39","BASI-50G","100g","g","89","69","BASI-100G","","","","",""
"Fresh Dill Suva Bhaji","Feathery dill fronds with a fresh anise-like flavour used in raita fish and North Indian sabzis","Herbs & Seasonings","","50","false","false","true","dill,suva,herb,anise","https://images.unsplash.com/photo-1606923829579-0cb981a83e2e?w=600&q=80","100g","g","29","24","DILL-100G","250g","g","59","44","DILL-250G","","","","",""
"Fresh Fenugreek Methi","Tender fresh methi leaves with a mild pleasant bitterness — great for methi paratha dal and sabzi","Herbs & Seasonings","","80","false","false","true","methi,fenugreek,herb,bitter","https://images.unsplash.com/photo-1606923829579-0cb981a83e2e?w=600&q=80","250g","g","29","24","METH-250G","500g","g","49","39","METH-500G","","","","",""
"Amul Taaza Toned Milk","UHT-processed toned milk with 3% fat — consistent quality ideal for everyday use cooking and chai","Milk","","200","false","false","true","milk,amul,toned,uht","https://images.unsplash.com/photo-1550583724-b2692b85b150?w=600&q=80","500ml","ml","28","25","AMLT-500ML","1L","L","52","47","AMLT-1L","2L","L","98","88","AMLT-2L"
"Organic Full Cream Milk","Certified organic full cream milk from grass-fed cows with 6% fat — rich creamy and nutritious","Milk","","100","true","true","true","milk,organic,fullcream,grass-fed","https://images.unsplash.com/photo-1550583724-b2692b85b150?w=600&q=80","500ml","ml","39","34","ORGM-500ML","1L","L","74","64","ORGM-1L","","","","",""
"Mother Dairy A2 Cow Milk","Fresh A2 beta-casein cow milk from indigenous desi breed cows — pure nutritious and easy to digest","Milk","","120","false","false","true","milk,a2,cow,desi,pure","https://images.unsplash.com/photo-1550583724-b2692b85b150?w=600&q=80","500ml","ml","32","28","A2ML-500ML","1L","L","60","52","A2ML-1L","","","","",""
"Skimmed Milk Low Fat","Low-fat skimmed milk with less than 0.5% fat — ideal for calorie-conscious diet and protein shakes","Milk","","80","false","false","true","milk,skimmed,lowfat,diet","https://images.unsplash.com/photo-1550583724-b2692b85b150?w=600&q=80","500ml","ml","26","22","SKIM-500ML","1L","L","48","42","SKIM-1L","","","","",""
"Soy Milk Unsweetened","Plant-based unsweetened soy milk made from non-GMO soybeans — high in protein and dairy-free","Milk","","60","false","false","true","soymilk,plant-based,vegan,protein","https://images.unsplash.com/photo-1550583724-b2692b85b150?w=600&q=80","200ml","ml","35","29","SOYM-200ML","1L","L","149","129","SOYM-1L","","","","",""
"Fresh Paneer Block","Soft fresh paneer made from whole cow milk — perfect for makhani saag tikka and bhurji","Paneer & Tofu","","100","false","true","true","paneer,fresh,block,cottage-cheese","https://images.unsplash.com/photo-1631452180519-c014fe946bc7?w=600&q=80","200g","g","89","79","PAN-200G","500g","g","209","189","PAN-500G","1kg","kg","399","359","PAN-1KG"
"Malai Paneer Creamy","Extra-creamy malai paneer with a melt-in-the-mouth texture made from enriched full-cream milk","Paneer & Tofu","","60","false","false","true","paneer,malai,creamy,soft","https://images.unsplash.com/photo-1631452180519-c014fe946bc7?w=600&q=80","200g","g","99","89","MLPN-200G","500g","g","229","199","MLPN-500G","","","","",""
"Smoked Paneer","Artisanal cold-smoked paneer with a subtle woody flavour — excellent for grilling and tikka","Paneer & Tofu","","40","false","true","true","paneer,smoked,artisan,grill","https://images.unsplash.com/photo-1631452180519-c014fe946bc7?w=600&q=80","200g","g","129","109","SMPN-200G","400g","g","239","199","SMPN-400G","","","","",""
"Organic Firm Tofu","Protein-rich firm tofu from non-GMO organic soy milk — ideal for stir fries grilling and curries","Paneer & Tofu","","50","true","false","true","tofu,firm,organic,vegan","https://images.unsplash.com/photo-1546069901-ba9599a7e63c?w=600&q=80","300g","g","89","79","TOFU-300G","600g","g","169","149","TOFU-600G","","","","",""
"Silken Tofu Soft","Ultra-smooth silken tofu perfect for desserts smoothies miso soup and creamy sauces","Paneer & Tofu","","40","false","false","true","tofu,silken,soft,smooth","https://images.unsplash.com/photo-1546069901-ba9599a7e63c?w=600&q=80","300g","g","79","69","SILK-300G","","","","","","","","","",""
"Organic Set Dahi Thick","Thick probiotic curd set in traditional style with live cultures — rich creamy and gut-friendly","Curd & Buttermilk","","100","true","true","true","dahi,curd,probiotic,thick","https://images.unsplash.com/photo-1488477181228-c8b89e3ff4b3?w=600&q=80","400g","g","59","49","DAHI-400G","1kg","kg","129","109","DAHI-1KG","","","","",""
"Mishti Doi Bengali Sweet","Classic Bengali sweet curd made with full cream milk and jaggery — caramelised and indulgent","Curd & Buttermilk","","60","false","true","true","doi,mishti,bengali,sweet","https://images.unsplash.com/photo-1488477181228-c8b89e3ff4b3?w=600&q=80","200g","g","49","39","MISH-200G","400g","g","89","74","MISH-400G","","","","",""
"Masala Chaas Spiced","Refreshing spiced buttermilk with roasted cumin ginger and coriander — the perfect summer cooler","Curd & Buttermilk","","80","false","false","true","chaas,buttermilk,masala,spiced","https://images.unsplash.com/photo-1488477181228-c8b89e3ff4b3?w=600&q=80","200ml","ml","29","24","CHAS-200ML","500ml","ml","59","49","CHAS-500ML","","","","",""
"Greek Style Yogurt","Thick strained Greek-style yogurt with 10% protein per serving — great for parfaits dips and marinades","Curd & Buttermilk","","70","false","true","true","yogurt,greek,thick,protein","https://images.unsplash.com/photo-1488477181228-c8b89e3ff4b3?w=600&q=80","150g","g","69","59","GRKY-150G","400g","g","159","139","GRKY-400G","","","","",""
"Mango Lassi Ready","Chilled ready-to-drink mango lassi made with fresh Alphonso pulp and thick dahi — a summer staple","Curd & Buttermilk","","60","false","true","true","lassi,mango,alphonso,drink","https://images.unsplash.com/photo-1488477181228-c8b89e3ff4b3?w=600&q=80","200ml","ml","49","39","MLAS-200ML","500ml","ml","109","89","MLAS-500ML","","","","",""
"Farm Fresh White Eggs","Cage-free white eggs from healthy farm hens — rich in protein perfect for everyday cooking","Eggs","","200","false","true","true","eggs,white,farmfresh,protein","https://images.unsplash.com/photo-1607290941745-cca4b4f0e44e?w=600&q=80","6 pcs","pcs","69","59","WEG-6PCS","12 pcs","pcs","129","109","WEG-12PCS","30 pcs","pcs","299","269","WEG-30PCS"
"Desi Brown Eggs Country","Country desi brown eggs with rich deep-yellow yolk from free-roaming village hens","Eggs","","150","false","false","true","eggs,brown,desi,country","https://images.unsplash.com/photo-1607290941745-cca4b4f0e44e?w=600&q=80","6 pcs","pcs","79","69","DEG-6PCS","12 pcs","pcs","149","129","DEG-12PCS","","","","",""
"Omega-3 Enriched Eggs","Nutritionally enhanced eggs from hens fed with flaxseed — high in heart-healthy omega-3 fatty acids","Eggs","","80","false","true","true","eggs,omega3,enriched,healthy","https://images.unsplash.com/photo-1607290941745-cca4b4f0e44e?w=600&q=80","6 pcs","pcs","99","84","OEG-6PCS","12 pcs","pcs","189","159","OEG-12PCS","","","","",""
"Organic Free Range Eggs","Certified organic eggs from hens raised on organic feed with outdoor access — rich and flavourful","Eggs","","60","true","false","true","eggs,organic,freerange,certified","https://images.unsplash.com/photo-1607290941745-cca4b4f0e44e?w=600&q=80","6 pcs","pcs","109","94","ORG-6PCS","12 pcs","pcs","199","169","ORG-12PCS","","","","",""
"Quail Eggs Mini","Delicate speckled quail eggs with a rich creamy yolk — great as appetisers in salads and for garnishing","Eggs","","50","false","false","true","eggs,quail,mini,gourmet","https://images.unsplash.com/photo-1607290941745-cca4b4f0e44e?w=600&q=80","12 pcs","pcs","99","84","QUAL-12PCS","24 pcs","pcs","189","159","QUAL-24PCS","","","","",""
"Amul Salted Butter","India's most loved table butter with a perfect salt balance — great for spreading toast and cooking","Butter & Cheese","","150","false","false","true","butter,amul,salted,dairy","https://images.unsplash.com/photo-1589985270826-4b7bb135bc9d?w=600&q=80","100g","g","59","54","ABUT-100G","500g","g","269","249","ABUT-500G","","","","",""
"Cultured Unsalted Butter","European-style cultured butter churned from cream with a rich tangy flavour — great for baking","Butter & Cheese","","70","false","false","true","butter,cultured,unsalted,european","https://images.unsplash.com/photo-1589985270826-4b7bb135bc9d?w=600&q=80","100g","g","89","79","CBUT-100G","250g","g","199","169","CBUT-250G","","","","",""
"White Homestyle Makhan","Pure churned white butter from fresh cream with no additives — as close to homemade as possible","Butter & Cheese","","80","false","false","true","butter,white,makhan,homestyle","https://images.unsplash.com/photo-1589985270826-4b7bb135bc9d?w=600&q=80","100g","g","69","59","MAKH-100G","250g","g","159","139","MAKH-250G","","","","",""
"Pure Cow Ghee","Traditional bilona-method cow ghee with a golden colour and nutty aroma — pure nutritious and aromatic","Butter & Cheese","","80","false","true","true","ghee,cow,pure,bilona","https://images.unsplash.com/photo-1589985270826-4b7bb135bc9d?w=600&q=80","250ml","ml","349","299","GHEE-250ML","500ml","ml","649","559","GHEE-500ML","1L","L","1249","1049","GHEE-1L"
"Cheddar Cheese Sliced","Mild aged cheddar slices with a smooth easy melt — ideal for sandwiches burgers and grilled cheese","Butter & Cheese","","70","false","false","true","cheese,cheddar,sliced,mild","https://images.unsplash.com/photo-1486297678162-eb2a19b0a32d?w=600&q=80","200g","g","149","129","CHED-200G","400g","g","279","249","CHED-400G","","","","",""
"Mozzarella Cheese Block","Fresh mozzarella with a milky mild flavour and excellent stretch — essential for pizzas and pasta","Butter & Cheese","","60","false","false","true","cheese,mozzarella,pizza,stretch","https://images.unsplash.com/photo-1486297678162-eb2a19b0a32d?w=600&q=80","200g","g","169","149","MOZZ-200G","400g","g","319","279","MOZZ-400G","","","","",""
